outputs/test_metrics.csv

method,n,auc,contact_n,top20_churn_rate,top20_mean_prediction,mean_prediction,observed_churn_rate
contract,1409,0.7372652354749543,281,0.398576512455516,0.4275300171526587,0.26861482637510287,0.2654364797728886
logistic,1409,0.8472073677956031,281,0.693950177935943,0.6401759488268317,0.27325652655173527,0.2654364797728886
trees,1409,0.8496654524787517,281,0.693950177935943,0.6478654375314629,0.2704734491434011,0.2654364797728886

results.md

## Partitions and training-only fitting

The 7,043 customers that are represented in the data were split into a training (60%), validation(20%), and test set(20%). The data was split so that each partition had an equivalent churn rate of 26.54%. There was no overlap between rows in partitions, each row was assigned to one and only one partition. The scaling, encoding, and fitting of each model was only performed on and using the data from the training set.

## Final-test comparison of the three methods

The results of the final test evaluation reported almost identical performances between the logistic regression and boosted trees models. The respective AUC for the contracts rule, logistic regression and boosted tree models were - 0.7373, 0.8472, and 0.8497. Boosted trees slightly surpassed logistic regression in AUC by 0.0025. The observed churn for each model per the 281 (top 20% list) were: contract list (112/281), logistic regression (195/281), and boosted trees (195/281). The logistic regression and boosted tree models outperformed the contract list model. Furthermore, the logistic regression and boosted tree models had a narrower gap in AUC and identical performances on the top 20% list observed churn.

## Calibration

A well calibrated model is predicting probabilities of observed churn rates that are consistently close to the observed values in each category. The boosted tree mean predicted values versus observed churn values are very accurate when looking at the test set from an overall view (mean prediction was 27.05% compared to observed 26.54%).

However, when looking into the top 20% contact list (281 customers), the mean predicted value is 64.79% compared to an observed value of 69.40%. The model is underestimating the true churn rate of these customers. There is also a large difference between the mean predicted churn rate (83.45%) versus the observed churn (91.43%) for the 35 customers who scored in the 0.8-1.0 probability range, which is the largest discrepancy between values in the dataset but is not supported by a large enough number of data points to suggest a calibration issue.